[
  {
    "id": "Anthropic.Claude",
    "name": "Claude",
    "desc": "Anthropic 官方桌面端，对话与 AI 编程",
    "site": "https://claude.ai/download",
    "category": "ai",
    "tags": [
      "AI",
      "anthropic",
      "对话"
    ],
    "ai": true
  },
  {
    "id": "Anysphere.Cursor",
    "name": "Cursor",
    "desc": "AI 代码编辑器，Tab 补全与 Agent 编程",
    "site": "https://cursor.com/",
    "category": "ai",
    "tags": [
      "AI",
      "编程",
      "编辑器"
    ],
    "ai": true
  },
  {
    "id": "Codeium.Windsurf",
    "name": "Windsurf",
    "desc": "AI 原生 IDE，Cascade 智能体多文件重构",
    "site": "https://windsurf.com/",
    "category": "ai",
    "tags": [
      "AI",
      "编程",
      "IDE"
    ],
    "ai": true
  },
  {
    "id": "kangfenmao.CherryStudio",
    "name": "Cherry Studio",
    "desc": "多模型桌面客户端，接国内外主流大模型",
    "site": "https://cherry-ai.com/",
    "category": "ai",
    "tags": [
      "AI",
      "客户端",
      "多模型"
    ],
    "github": "CherryHQ/cherry-studio",
    "ai": true
  },
  {
    "id": "Bin-Huang.Chatbox",
    "name": "Chatbox",
    "desc": "轻量多模型聊天客户端，支持本地模型",
    "site": "https://chatboxai.app/",
    "category": "ai",
    "tags": [
      "AI",
      "客户端",
      "聊天"
    ],
    "github": "Bin-Huang/chatbox",
    "ai": true
  },
  {
    "id": "ElementLabs.LMStudio",
    "name": "LM Studio",
    "desc": "本地运行大模型，离线对话零密钥",
    "site": "https://lmstudio.ai/",
    "category": "ai",
    "tags": [
      "AI",
      "本地模型",
      "离线"
    ],
    "ai": true
  },
  {
    "id": "Jan.Jan",
    "name": "Jan",
    "desc": "开源本地 AI 助手，离线运行开源模型",
    "site": "https://jan.ai/",
    "category": "ai",
    "tags": [
      "AI",
      "本地模型",
      "开源"
    ],
    "github": "janhq/jan",
    "ai": true
  },
  {
    "id": "nomic.gpt4all",
    "name": "GPT4All",
    "desc": "本地开源大模型桌面客户端",
    "site": "https://www.nomic.ai/gpt4all",
    "category": "ai",
    "tags": [
      "AI",
      "本地模型",
      "开源"
    ],
    "github": "nomic-ai/gpt4all",
    "ai": true
  },
  {
    "id": "Alibaba.Qwen",
    "name": "通义千问",
    "desc": "阿里通义千问桌面端，中文对话与办公",
    "site": "https://tongyi.aliyun.com/",
    "category": "ai",
    "tags": [
      "AI",
      "阿里",
      "对话"
    ],
    "ai": true
  },
  {
    "id": "MoonshotAI.Kimi",
    "name": "Kimi",
    "desc": "月之暗面 Kimi 桌面端，长文本与联网搜索",
    "site": "https://www.kimi.com/",
    "category": "ai",
    "tags": [
      "AI",
      "月之暗面",
      "对话"
    ],
    "ai": true
  },
  {
    "id": "ZhipuAI.ChatGLM",
    "name": "智谱清言",
    "desc": "智谱 GLM 大模型桌面端",
    "site": "https://chatglm.cn/",
    "category": "ai",
    "tags": [
      "AI",
      "智谱",
      "对话"
    ],
    "ai": true
  },
  {
    "id": "Perplexity.Perplexity",
    "name": "Perplexity",
    "desc": "AI 搜索与深度研究桌面端",
    "site": "https://www.perplexity.ai/",
    "category": "ai",
    "tags": [
      "AI",
      "搜索"
    ],
    "ai": true
  },
  {
    "id": "Google.Chrome",
    "name": "Chrome",
    "desc": "谷歌浏览器，快速安全的网页浏览",
    "site": "https://www.google.com/chrome/",
    "category": "browser",
    "tags": [
      "google",
      "浏览器"
    ]
  },
  {
    "id": "Mozilla.Firefox",
    "name": "Firefox",
    "desc": "自由开源的火狐浏览器",
    "site": "https://www.mozilla.org/firefox/",
    "category": "browser",
    "tags": [
      "火狐",
      "浏览器"
    ]
  },
  {
    "id": "Microsoft.Edge",
    "name": "Microsoft Edge",
    "desc": "微软新一代浏览器，内置 Copilot AI 助手",
    "site": "https://www.microsoft.com/edge",
    "category": "browser",
    "tags": [
      "微软",
      "浏览器",
      "AI"
    ],
    "ai": true
  },
  {
    "id": "Tencent.QQBrowser",
    "name": "QQ浏览器",
    "desc": "腾讯出品的极速浏览器",
    "site": "https://browser.qq.com/",
    "category": "browser",
    "tags": [
      "腾讯",
      "浏览器"
    ]
  },
  {
    "id": "Tencent.WeChat",
    "name": "微信",
    "desc": "腾讯微信，是一个生活方式",
    "site": "https://weixin.qq.com/",
    "category": "social",
    "tags": [
      "wechat",
      "聊天"
    ]
  },
  {
    "id": "Tencent.QQ",
    "name": "QQ",
    "desc": "腾讯 QQ 即时通讯",
    "site": "https://im.qq.com/",
    "category": "social",
    "tags": [
      "腾讯",
      "聊天"
    ]
  },
  {
    "id": "Tencent.TIM",
    "name": "TIM",
    "desc": "轻聊版 QQ，办公更简洁",
    "site": "https://tim.qq.com/",
    "category": "social",
    "tags": [
      "腾讯",
      "办公"
    ]
  },
  {
    "id": "Tencent.WeCom",
    "name": "企业微信",
    "desc": "企业的专业办公管理工具",
    "site": "https://work.weixin.qq.com/",
    "category": "social",
    "tags": [
      "企业",
      "办公"
    ]
  },
  {
    "id": "ByteDance.Feishu",
    "name": "飞书",
    "desc": "一站式企业协作，内置飞书智能伙伴",
    "site": "https://www.feishu.cn/",
    "category": "social",
    "tags": [
      "字节",
      "协作",
      "AI"
    ],
    "ai": true
  },
  {
    "id": "Alibaba.DingTalk.Mainland",
    "name": "钉钉",
    "desc": "企业智能办公平台，AI 助理提效",
    "site": "https://www.dingtalk.com/",
    "category": "social",
    "tags": [
      "阿里",
      "dingtalk",
      "AI"
    ],
    "ai": true
  },
  {
    "id": "Kingsoft.WPSOffice",
    "name": "WPS Office",
    "desc": "金山办公，内置 WPS AI 智能助手",
    "site": "https://www.wps.cn/",
    "category": "office",
    "tags": [
      "金山",
      "文档",
      "AI"
    ],
    "ai": true
  },
  {
    "id": "Notion.Notion",
    "name": "Notion",
    "desc": "一体化笔记协作，内置 Notion AI",
    "site": "https://www.notion.so/",
    "category": "office",
    "tags": [
      "笔记",
      "AI"
    ],
    "ai": true
  },
  {
    "id": "Obsidian.Obsidian",
    "name": "Obsidian",
    "desc": "本地优先的 Markdown 知识库",
    "site": "https://obsidian.md/",
    "category": "office",
    "tags": [
      "笔记",
      "markdown"
    ]
  },
  {
    "id": "Xmind.Xmind",
    "name": "XMind",
    "desc": "思维导图，AI 一键生成与扩写",
    "site": "https://xmind.cn/",
    "category": "office",
    "tags": [
      "思维导图",
      "AI"
    ],
    "ai": true
  },
  {
    "id": "appmakes.Typora",
    "name": "Typora",
    "desc": "所见即所得的 Markdown 编辑器",
    "site": "https://typora.io/",
    "category": "office",
    "tags": [
      "markdown",
      "编辑器"
    ]
  },
  {
    "id": "JGraph.Draw",
    "name": "draw.io",
    "desc": "免费开源的流程图与图表绘制",
    "site": "https://www.drawio.com/",
    "category": "office",
    "tags": [
      "流程图",
      "绘图",
      "开源"
    ],
    "github": "jgraph/drawio-desktop"
  },
  {
    "id": "Microsoft.VisualStudioCode",
    "name": "VS Code",
    "desc": "微软代码编辑器，Copilot AI 编程",
    "site": "https://code.visualstudio.com/",
    "category": "dev",
    "tags": [
      "vscode",
      "编辑器",
      "AI"
    ],
    "ai": true
  },
  {
    "id": "JetBrains.IntelliJIDEA.Community",
    "name": "IntelliJ IDEA 社区版",
    "desc": "Java/Kotlin 集成开发环境",
    "site": "https://www.jetbrains.com/idea/",
    "category": "dev",
    "tags": [
      "idea",
      "java"
    ]
  },
  {
    "id": "Notepad++.Notepad++",
    "name": "Notepad++",
    "desc": "轻量开源的文本编辑器",
    "site": "https://notepad-plus-plus.org/",
    "category": "dev",
    "tags": [
      "编辑器"
    ],
    "github": "notepad-plus-plus/notepad-plus-plus"
  },
  {
    "id": "Git.Git",
    "name": "Git",
    "desc": "分布式版本控制系统",
    "site": "https://git-scm.com/",
    "category": "dev",
    "tags": [
      "版本控制"
    ],
    "github": "git-for-windows/git"
  },
  {
    "id": "OpenJS.NodeJS.LTS",
    "name": "Node.js LTS",
    "desc": "JavaScript 运行时（长期支持版）",
    "site": "https://nodejs.org/",
    "category": "dev",
    "tags": [
      "node",
      "运行时"
    ]
  },
  {
    "id": "Python.Python.3.13",
    "name": "Python 3.13",
    "desc": "Python 编程语言解释器",
    "site": "https://www.python.org/",
    "category": "dev",
    "tags": [
      "python",
      "运行时"
    ]
  },
  {
    "id": "Postman.Postman",
    "name": "Postman",
    "desc": "API 开发与调试平台",
    "site": "https://www.postman.com/",
    "category": "dev",
    "tags": [
      "api",
      "调试"
    ]
  },
  {
    "id": "Microsoft.WindowsTerminal",
    "name": "Windows Terminal",
    "desc": "现代化多标签终端",
    "site": "https://aka.ms/terminal",
    "category": "dev",
    "tags": [
      "终端",
      "微软"
    ],
    "github": "microsoft/terminal"
  },
  {
    "id": "Genymobile.scrcpy",
    "name": "scrcpy",
    "desc": "开源安卓投屏与电脑控制工具",
    "site": "https://github.com/Genymobile/scrcpy",
    "category": "dev",
    "tags": [
      "安卓",
      "投屏",
      "开源"
    ],
    "github": "Genymobile/scrcpy"
  },
  {
    "id": "GitHub.cli",
    "name": "GitHub CLI",
    "desc": "GitHub 官方命令行（认证后本商店的 Release 拉取提速到 5000 次/小时）",
    "site": "https://cli.github.com/",
    "category": "dev",
    "tags": [
      "github",
      "cli",
      "gh"
    ],
    "github": "cli/cli"
  },
  {
    "id": "VideoLAN.VLC",
    "name": "VLC 播放器",
    "desc": "开源全能媒体播放器",
    "site": "https://www.videolan.org/",
    "category": "media",
    "tags": [
      "播放器"
    ]
  },
  {
    "id": "Daum.PotPlayer",
    "name": "PotPlayer",
    "desc": "功能强大的影音播放器",
    "site": "https://potplayer.daum.net/",
    "category": "media",
    "tags": [
      "播放器"
    ]
  },
  {
    "id": "NetEase.CloudMusic",
    "name": "网易云音乐",
    "desc": "网易出品的音乐社区",
    "site": "https://music.163.com/",
    "category": "media",
    "tags": [
      "音乐"
    ]
  },
  {
    "id": "Tencent.QQMusic",
    "name": "QQ音乐",
    "desc": "腾讯音乐流媒体服务",
    "site": "https://y.qq.com/",
    "category": "media",
    "tags": [
      "音乐"
    ]
  },
  {
    "id": "Bilibili.Bilibili",
    "name": "哔哩哔哩",
    "desc": "B 站官方桌面客户端",
    "site": "https://www.bilibili.com/",
    "category": "media",
    "tags": [
      "b站",
      "视频"
    ]
  },
  {
    "id": "ByteDance.JianyingPro",
    "name": "剪映专业版",
    "desc": "抖音视频剪辑，AI 字幕与成片",
    "site": "https://www.capcut.cn/",
    "category": "media",
    "tags": [
      "剪辑",
      "视频",
      "AI"
    ],
    "ai": true
  },
  {
    "id": "OBSProject.OBSStudio",
    "name": "OBS Studio",
    "desc": "开源直播与录屏软件",
    "site": "https://obsproject.com/",
    "category": "media",
    "tags": [
      "直播",
      "录屏"
    ],
    "github": "obsproject/obs-studio"
  },
  {